{
  "schema_version": 1,
  "id": "bobin_craft:debug/first_person_fixture_slim_sockets",
  "rig_id": "bobin_craft:debug/first_person_rig_slim",
  "sockets": [
    {
      "name": "grip_primary",
      "node": "grip_primary",
      "transform": {
        "translation": [
          0,
          0,
          0
        ],
        "rotation": [
          0,
          0,
          0,
          1
        ],
        "scale": [
          1,
          1,
          1
        ]
      }
    },
    {
      "name": "grip_secondary",
      "node": "grip_secondary",
      "transform": {
        "translation": [
          0,
          0,
          0
        ],
        "rotation": [
          0,
          0,
          0,
          1
        ],
        "scale": [
          1,
          1,
          1
        ]
      }
    },
    {
      "name": "hand_primary",
      "node": "hand_primary",
      "transform": {
        "translation": [
          0,
          0,
          0
        ],
        "rotation": [
          0,
          0,
          0,
          1
        ],
        "scale": [
          1,
          1,
          1
        ]
      }
    },
    {
      "name": "hand_secondary",
      "node": "hand_secondary",
      "transform": {
        "translation": [
          0,
          0,
          0
        ],
        "rotation": [
          0,
          0,
          0,
          1
        ],
        "scale": [
          1,
          1,
          1
        ]
      }
    }
  ]
}
